{
  "$schema": "../../schema/tenant-override.schema.json",
  "tenantId": "example-corp",
  "baseRulesetId": "https://evolith.dev/rulesets/phase-gates/phase-gates.rules.json",
  "version": "1.0.0",
  "effectiveDate": "2026-01-01",
  "approvedBy": "Engineering Director",
  "rationale": "Example Corp operates under ISO-27001 certification which mandates a Security Clearance artifact before Phase 1 exit. Ballpark Estimation is replaced by the internal Sprint-0 Sizing document.",
  "overrides": {
    "gates[phase=1].mandatoryEvidence": {
      "add": [
        {
          "artifact": "ISO-27001 Security Clearance",
          "validation": "Current ISO-27001 certificate on file, valid for the project duration"
        }
      ]
    }
  },
  "waivers": []
}
